{
  "schemaVersion": "1.0.0",
  "id": "T-G4-CROWD",
  "title": "FR-CROWD implementation contract",
  "sourceHashes": {
    "prd": "baa521d9c67e67a86d7ddb111c793b67462ed4c7acc89cec34ab9f5ade077299",
    "requirements": "e0f9f1284473fe097fde591138d16984ae8580feaf13333e22594717eec690ff",
    "audit": "ab4be13b6aeac998f13daa89ae08f4b9f5d6280b4018bd171b7b128b412a47f8"
  },
  "dependencyGroup": "G4",
  "cluster": "C-G4-IMPLEMENTATION",
  "riskLevel": "MEDIUM",
  "autonomyLevel": "AUTONOMOUS",
  "dependencies": [
    "T-G0-COL-01",
    "T-G0-COL-02",
    "T-G0-CORE",
    "T-G0-COST-01",
    "T-G0-COST-02",
    "T-G0-DATA",
    "T-G0-DISC",
    "T-G0-DR",
    "T-G0-MCP",
    "T-G0-PROV-01",
    "T-G0-PROV-02",
    "T-G0-SEC-01",
    "T-G0-SEC-02",
    "T-G0-TRACE",
    "T-G1-COST",
    "T-G1-DATA-01",
    "T-G1-DATA-02",
    "T-G1-DISC-01",
    "T-G1-DISC-02",
    "T-G1-EVAL-01",
    "T-G1-EVAL-02",
    "T-G1-EXEC-01",
    "T-G1-EXEC-02",
    "T-G1-EXEC-03",
    "T-G1-MAT-01",
    "T-G1-MAT-02",
    "T-G1-OBJ-01",
    "T-G1-OBJ-02",
    "T-G1-SIG",
    "T-G1-SOLSEC",
    "T-G1-SUP",
    "T-G1-TRD",
    "T-G2-ADM",
    "T-G2-ALERT",
    "T-G2-DR",
    "T-G2-PROD",
    "T-G2-WF",
    "T-G3-ADM",
    "T-G3-AGT-01",
    "T-G3-AGT-02"
  ],
  "requirements": [
    "FR-CROWD-001",
    "FR-CROWD-002",
    "FR-CROWD-003",
    "FR-CROWD-004"
  ],
  "acceptanceCriteria": [],
  "taskAcceptanceFacets": [
    {
      "acceptanceId": "AC-074",
      "facetId": "AC-074:T-G4-CROWD:INTERFACE_FACET",
      "text": "Provide only the interfaces owned by T-G4-CROWD for FR-CROWD-001, FR-CROWD-002, FR-CROWD-003, FR-CROWD-004 that the unchanged AC-074 system or integration oracle consumes. This facet does not claim full AC-074 satisfaction.",
      "sourceAcceptanceSha256": "3489e8882ab8d5b0b3351101d53c42cb22fb2286cdabb883e1da7a6db60fcb72"
    },
    {
      "acceptanceId": "AC-075",
      "facetId": "AC-075:T-G4-CROWD:INTERFACE_FACET",
      "text": "Provide only the interfaces owned by T-G4-CROWD for FR-CROWD-001, FR-CROWD-002, FR-CROWD-003, FR-CROWD-004 that the unchanged AC-075 system or integration oracle consumes. This facet does not claim full AC-075 satisfaction.",
      "sourceAcceptanceSha256": "1b91cf64e412a3491155e78fff83b45ffd1be95fe85e4af079f97d9634d74f9a"
    },
    {
      "acceptanceId": "AC-076",
      "facetId": "AC-076:T-G4-CROWD:INTERFACE_FACET",
      "text": "Provide only the interfaces owned by T-G4-CROWD for FR-CROWD-001, FR-CROWD-002, FR-CROWD-003, FR-CROWD-004 that the unchanged AC-076 system or integration oracle consumes. This facet does not claim full AC-076 satisfaction.",
      "sourceAcceptanceSha256": "84dafb8a04e868e4b9a9f12c875046b5eb3092c559e5f3ec6aa22d61befb9fef"
    },
    {
      "acceptanceId": "AC-091",
      "facetId": "AC-091:T-G4-CROWD:INTERFACE_FACET",
      "text": "Provide only the interfaces owned by T-G4-CROWD for FR-CROWD-001, FR-CROWD-002, FR-CROWD-003, FR-CROWD-004 that the unchanged AC-091 system or integration oracle consumes. This facet does not claim full AC-091 satisfaction.",
      "sourceAcceptanceSha256": "2ad7358711112121d7f7ea1f6ade0f4108cf4b562ff132b6b09e46ff9eda277f"
    },
    {
      "acceptanceId": "AC-092",
      "facetId": "AC-092:T-G4-CROWD:INTERFACE_FACET",
      "text": "Provide only the interfaces owned by T-G4-CROWD for FR-CROWD-001, FR-CROWD-002, FR-CROWD-003, FR-CROWD-004 that the unchanged AC-092 system or integration oracle consumes. This facet does not claim full AC-092 satisfaction.",
      "sourceAcceptanceSha256": "c7914fe4b07eade381f32708997de4e41f88fd9cce51fb0165ca03fc876b8c8a"
    }
  ],
  "invariants": [
    "INV-001",
    "INV-002",
    "INV-003",
    "INV-004",
    "INV-005",
    "INV-006",
    "INV-007",
    "INV-008",
    "INV-009",
    "INV-010"
  ],
  "adrs": [
    "ADR-001"
  ],
  "ownerPackages": [
    "packages/crowding"
  ],
  "readSet": [
    "docs/spec/**",
    "artifacts/context/T-G4-CROWD/**",
    "artifacts/conformance/T-G4-CROWD/manifest.json"
  ],
  "writeSet": [
    "packages/crowding/**"
  ],
  "allowedPaths": [
    "packages/crowding/**",
    "tests/acceptance/**",
    "tests/negative/**",
    "tests/task-facets/**",
    "tests/fixtures/**",
    "docs/implementation/**"
  ],
  "forbiddenPaths": [
    "docs/spec/**",
    "artifacts/spec/**",
    "tasks/generated/**",
    ".github/workflows/**",
    "tests/conformance/**",
    "artifacts/conformance/T-G4-CROWD/**",
    "infra/migrations/**"
  ],
  "exclusiveLocks": [
    "packages/crowding/public-api"
  ],
  "interfaceHashes": {
    "packages/crowding:contract": "3b842328d0233ccf4f354c4b866bdf9f4bcc40a985a53ad6c2694f75db5b03b4"
  },
  "deliverables": [
    "packages/crowding/** @requirement FR-CROWD-001",
    "packages/crowding/** @requirement FR-CROWD-002",
    "packages/crowding/** @requirement FR-CROWD-003",
    "packages/crowding/** @requirement FR-CROWD-004",
    "packages/crowding implementation and tests"
  ],
  "constraints": [
    "Preserve every referenced normative ID and degraded behavior.",
    "Keep product influence disabled until explicit activation gates pass.",
    "Use point-in-time and evidence semantics where externally sourced data is involved.",
    "Do not modify the control-plane-owned immutable conformance oracle."
  ],
  "nonGoals": [
    "No financial execution, signing, custody, or transaction submission.",
    "No automatic alpha or product capability activation.",
    "No unrelated dependency-group implementation."
  ],
  "degradedBehavior": "Fail closed or return NOT_AVAILABLE/INSUFFICIENT_DATA with provenance; never fabricate success.",
  "rollback": "Revert the single atomic task commit and restore the prior schema/config artifact; migrations require a forward compensating migration.",
  "requiredTests": [
    "tests/task-facets/T-G4-CROWD.spec.ts",
    "tests/task-facets/T-G4-CROWD.negative.spec.ts"
  ],
  "verificationCommands": [
    {
      "command": "pnpm exec vitest run tests/task-facets/T-G4-CROWD.spec.ts tests/task-facets/T-G4-CROWD.negative.spec.ts",
      "expected": "all task-owned positive and negative tests execute with zero skips"
    },
    {
      "command": "pnpm exec vitest run tests/conformance/task-oracle.spec.ts",
      "expected": "immutable conformance and test-quality oracle passes"
    },
    {
      "command": "pnpm architecture:verify",
      "expected": "all architecture fitness controls pass"
    },
    {
      "command": "pnpm prohibited-capabilities:scan",
      "expected": "no prohibited executable capability"
    }
  ],
  "complexityBudget": {
    "maxFiles": 24,
    "maxChangedLines": 1800,
    "maxCyclomaticComplexity": 12
  },
  "changeBudget": {
    "maxMigrations": 0,
    "maxPublicInterfaces": 4,
    "requiresSplitAboveBudget": true
  },
  "stopConditions": [
    "A source hash differs from the task contract.",
    "A dependency is not MERGED or its public interface hash changed.",
    "Required behavior exceeds a declared budget without an approved split.",
    "A prohibited capability or activation path would be introduced.",
    "The implementation brief reports SPECIFICATION_GAP or an invalid reference."
  ],
  "completionDefinition": [
    "All mapped positive and negative task-owned tests pass.",
    "The immutable conformance and test-quality oracle passes.",
    "Deterministic verifier derives PASS from repository evidence.",
    "One atomic task commit exists and architecture checks pass.",
    "Degraded, replay, rollback, and observability behavior is documented and tested."
  ],
  "sourceReferences": [
    {
      "path": "docs/spec/crypto_intelligence_agent_gateway_PRD_FINAL_v6.0.md",
      "line": 6088,
      "id": "FR-CROWD-001"
    },
    {
      "path": "docs/spec/crypto_intelligence_agent_gateway_PRD_FINAL_v6.0.md",
      "line": 6089,
      "id": "FR-CROWD-002"
    },
    {
      "path": "docs/spec/crypto_intelligence_agent_gateway_PRD_FINAL_v6.0.md",
      "line": 6090,
      "id": "FR-CROWD-003"
    },
    {
      "path": "docs/spec/crypto_intelligence_agent_gateway_PRD_FINAL_v6.0.md",
      "line": 6091,
      "id": "FR-CROWD-004"
    }
  ],
  "specificationStatus": "SPECIFICATION_GAP",
  "conformanceManifestPath": "artifacts/conformance/T-G4-CROWD/manifest.json",
  "conformanceManifestSha256": "e707f9d45bb97975c20d7d8ec1edb64b5f0612328369c9e89d5d05dceea7c830",
  "testQualityGate": "NEGATIVE_CASE"
}
