{
  "schemaVersion": "1.0.0",
  "id": "T-G4-WHY",
  "title": "FR-WHY implementation contract",
  "sourceHashes": {
    "prd": "baa521d9c67e67a86d7ddb111c793b67462ed4c7acc89cec34ab9f5ade077299",
    "requirements": "e0f9f1284473fe097fde591138d16984ae8580feaf13333e22594717eec690ff",
    "audit": "ab4be13b6aeac998f13daa89ae08f4b9f5d6280b4018bd171b7b128b412a47f8"
  },
  "dependencyGroup": "G4",
  "cluster": "C-G4-IMPLEMENTATION",
  "riskLevel": "MEDIUM",
  "autonomyLevel": "AUTONOMOUS",
  "dependencies": [
    "T-G0-COL-01",
    "T-G0-COL-02",
    "T-G0-CORE",
    "T-G0-COST-01",
    "T-G0-COST-02",
    "T-G0-DATA",
    "T-G0-DISC",
    "T-G0-DR",
    "T-G0-MCP",
    "T-G0-PROV-01",
    "T-G0-PROV-02",
    "T-G0-SEC-01",
    "T-G0-SEC-02",
    "T-G0-TRACE",
    "T-G1-COST",
    "T-G1-DATA-01",
    "T-G1-DATA-02",
    "T-G1-DISC-01",
    "T-G1-DISC-02",
    "T-G1-EVAL-01",
    "T-G1-EVAL-02",
    "T-G1-EXEC-01",
    "T-G1-EXEC-02",
    "T-G1-EXEC-03",
    "T-G1-MAT-01",
    "T-G1-MAT-02",
    "T-G1-OBJ-01",
    "T-G1-OBJ-02",
    "T-G1-SIG",
    "T-G1-SOLSEC",
    "T-G1-SUP",
    "T-G1-TRD",
    "T-G2-ADM",
    "T-G2-ALERT",
    "T-G2-DR",
    "T-G2-PROD",
    "T-G2-WF",
    "T-G3-ADM",
    "T-G3-AGT-01",
    "T-G3-AGT-02"
  ],
  "requirements": [
    "FR-WHY-001",
    "FR-WHY-002"
  ],
  "acceptanceCriteria": [],
  "taskAcceptanceFacets": [
    {
      "acceptanceId": "AC-070",
      "facetId": "AC-070:T-G4-WHY:INTERFACE_FACET",
      "text": "Provide only the interfaces owned by T-G4-WHY for FR-WHY-001, FR-WHY-002 that the unchanged AC-070 system or integration oracle consumes. This facet does not claim full AC-070 satisfaction.",
      "sourceAcceptanceSha256": "093eddad1bec2c0b1d5ba883659abe2f87b9075bf7107e2701b26121ed559931"
    },
    {
      "acceptanceId": "AC-071",
      "facetId": "AC-071:T-G4-WHY:INTERFACE_FACET",
      "text": "Provide only the interfaces owned by T-G4-WHY for FR-WHY-001, FR-WHY-002 that the unchanged AC-071 system or integration oracle consumes. This facet does not claim full AC-071 satisfaction.",
      "sourceAcceptanceSha256": "8b92ac935da656c03924426f05ec394cf5013375d141b0366fc80e3babddc34a"
    },
    {
      "acceptanceId": "AC-072",
      "facetId": "AC-072:T-G4-WHY:INTERFACE_FACET",
      "text": "Provide only the interfaces owned by T-G4-WHY for FR-WHY-001, FR-WHY-002 that the unchanged AC-072 system or integration oracle consumes. This facet does not claim full AC-072 satisfaction.",
      "sourceAcceptanceSha256": "fb0461215908ceda2e7be4dd6d755467c78f6954da9345820d878e4a8cfd4d3c"
    },
    {
      "acceptanceId": "AC-073",
      "facetId": "AC-073:T-G4-WHY:INTERFACE_FACET",
      "text": "Provide only the interfaces owned by T-G4-WHY for FR-WHY-001, FR-WHY-002 that the unchanged AC-073 system or integration oracle consumes. This facet does not claim full AC-073 satisfaction.",
      "sourceAcceptanceSha256": "c4f9afd89a470c8fa768ceb8523987664deb08bcbc3dff3d3b595e0f9e8417db"
    }
  ],
  "invariants": [
    "INV-001",
    "INV-002",
    "INV-003",
    "INV-004",
    "INV-005",
    "INV-006",
    "INV-007",
    "INV-008",
    "INV-009",
    "INV-010"
  ],
  "adrs": [
    "ADR-001"
  ],
  "ownerPackages": [
    "packages/thesis"
  ],
  "readSet": [
    "docs/spec/**",
    "artifacts/context/T-G4-WHY/**",
    "artifacts/conformance/T-G4-WHY/manifest.json"
  ],
  "writeSet": [
    "packages/thesis/**"
  ],
  "allowedPaths": [
    "packages/thesis/**",
    "tests/acceptance/**",
    "tests/negative/**",
    "tests/task-facets/**",
    "tests/fixtures/**",
    "docs/implementation/**"
  ],
  "forbiddenPaths": [
    "docs/spec/**",
    "artifacts/spec/**",
    "tasks/generated/**",
    ".github/workflows/**",
    "tests/conformance/**",
    "artifacts/conformance/T-G4-WHY/**",
    "infra/migrations/**"
  ],
  "exclusiveLocks": [
    "packages/thesis/public-api"
  ],
  "interfaceHashes": {
    "packages/thesis:contract": "5f104e56211b6bede5057d1621d462a9c479850917e7f5e3784312d121f85222"
  },
  "deliverables": [
    "packages/thesis/** @requirement FR-WHY-001",
    "packages/thesis/** @requirement FR-WHY-002",
    "packages/thesis implementation and tests"
  ],
  "constraints": [
    "Preserve every referenced normative ID and degraded behavior.",
    "Keep product influence disabled until explicit activation gates pass.",
    "Use point-in-time and evidence semantics where externally sourced data is involved.",
    "Do not modify the control-plane-owned immutable conformance oracle."
  ],
  "nonGoals": [
    "No financial execution, signing, custody, or transaction submission.",
    "No automatic alpha or product capability activation.",
    "No unrelated dependency-group implementation."
  ],
  "degradedBehavior": "Fail closed or return NOT_AVAILABLE/INSUFFICIENT_DATA with provenance; never fabricate success.",
  "rollback": "Revert the single atomic task commit and restore the prior schema/config artifact; migrations require a forward compensating migration.",
  "requiredTests": [
    "tests/task-facets/T-G4-WHY.spec.ts",
    "tests/task-facets/T-G4-WHY.negative.spec.ts"
  ],
  "verificationCommands": [
    {
      "command": "pnpm exec vitest run tests/task-facets/T-G4-WHY.spec.ts tests/task-facets/T-G4-WHY.negative.spec.ts",
      "expected": "all task-owned positive and negative tests execute with zero skips"
    },
    {
      "command": "pnpm exec vitest run tests/conformance/task-oracle.spec.ts",
      "expected": "immutable conformance and test-quality oracle passes"
    },
    {
      "command": "pnpm architecture:verify",
      "expected": "all architecture fitness controls pass"
    },
    {
      "command": "pnpm prohibited-capabilities:scan",
      "expected": "no prohibited executable capability"
    }
  ],
  "complexityBudget": {
    "maxFiles": 24,
    "maxChangedLines": 1800,
    "maxCyclomaticComplexity": 12
  },
  "changeBudget": {
    "maxMigrations": 0,
    "maxPublicInterfaces": 4,
    "requiresSplitAboveBudget": true
  },
  "stopConditions": [
    "A source hash differs from the task contract.",
    "A dependency is not MERGED or its public interface hash changed.",
    "Required behavior exceeds a declared budget without an approved split.",
    "A prohibited capability or activation path would be introduced.",
    "The implementation brief reports SPECIFICATION_GAP or an invalid reference."
  ],
  "completionDefinition": [
    "All mapped positive and negative task-owned tests pass.",
    "The immutable conformance and test-quality oracle passes.",
    "Deterministic verifier derives PASS from repository evidence.",
    "One atomic task commit exists and architecture checks pass.",
    "Degraded, replay, rollback, and observability behavior is documented and tested."
  ],
  "sourceReferences": [
    {
      "path": "docs/spec/crypto_intelligence_agent_gateway_PRD_FINAL_v6.0.md",
      "line": 6076,
      "id": "FR-WHY-001"
    },
    {
      "path": "docs/spec/crypto_intelligence_agent_gateway_PRD_FINAL_v6.0.md",
      "line": 6077,
      "id": "FR-WHY-002"
    }
  ],
  "specificationStatus": "READY",
  "conformanceManifestPath": "artifacts/conformance/T-G4-WHY/manifest.json",
  "conformanceManifestSha256": "6b3668317c97552d5358f744784891356f20560a550546b3e96979cf1dd99ce8",
  "testQualityGate": "NEGATIVE_CASE"
}
